<?xml version="1.0" encoding="UTF-8"?>
<!DOCTYPE fias2 SYSTEM "import.dtd" >
<fias2 uniqueid="">
  <record>
    <client_id>client_id</client_id>
    <customer_id>customer_id</customer_id>
    <address>
      <address_number>address_number</address_number>
      <title>title</title>
      <name>name</name>
      <name_2>name_2</name_2>
      <street>street</street>
      <street_2>street_2</street_2>
      <zip_code>zip_code</zip_code>
      <city>city</city>
      <country_code>country_code</country_code>
      <zip_po_box>zip_po_box</zip_po_box>
      <po_box>po_box</po_box>
      <phone_number>phone_number</phone_number>
      <fax_number>fax_number</fax_number>
      <email_address>email_address</email_address>
      <address_line_1>address_line_1</address_line_1>
      <address_line_2>address_line_2</address_line_2>
      <address_line_3>address_line_3</address_line_3>
      <address_line_4>address_line_4</address_line_4>
      <address_line_5>address_line_5</address_line_5>
      <address_line_6>address_line_6</address_line_6>
      <address_line_7>address_line_7</address_line_7>
    </address>
    <account>
      <external_customer_id>external_customer_id</external_customer_id>
      <vat_id>vat_id</vat_id>
      <language_debtor>language_debtor</language_debtor>
      <account_group>account_group</account_group>
      <reminder_block>reminder_block</reminder_block>
      <affiliates_percent_rate>affiliates_percent_rate</affiliates_percent_rate>
      <credit_card>credit_card</credit_card>
      <cc_expiry_date>cc_expiry_date</cc_expiry_date>
      <issue_date>issue_date</issue_date>
      <issue_number>issue_number</issue_number>
      <bank_id>bank_id</bank_id>
      <bank_account>bank_account</bank_account>
      <account_owner>account_owner</account_owner>
      <rib_code>rib_code</rib_code>
    </account>
    <booking>
      <transaction_id>transaction_id</transaction_id>
      <address_number>address_number</address_number>
      <transaction_code>transaction_code</transaction_code>
      <transaction_subcode>transaction_subcode</transaction_subcode>
      <transaction_date>transaction_date</transaction_date>
      <due_date>due_date</due_date>
      <amount>amount</amount>
      <invoice_ext>invoice_ext</invoice_ext>
      <order_number>order_number</order_number>
      <distribution_channel>distribution_channel</distribution_channel>
      <sale_point>sale_point</sale_point>
      <generic_field_1>generic_field_1</generic_field_1>
      <generic_field_2>generic_field_2</generic_field_2>
      <generic_field_3>generic_field_3</generic_field_3>
      <position_number>position_number</position_number>
      <payment_type>payment_type</payment_type>
      <text_line>text_line</text_line>
      <bank_id>bank_id</bank_id>
      <bank_account>bank_account</bank_account>
      <reminder_level>reminder_level</reminder_level>
      <account_owner>account_owner</account_owner>
      <reminder_block>reminder_block</reminder_block>
      <rib_code>rib_code</rib_code>
      <credit_card>credit_card</credit_card>
      <cc_expiry_date>cc_expiry_date</cc_expiry_date>
      <issue_date>issue_date</issue_date>
      <issue_number>issue_number</issue_number>
      <authorization_code>authorization_code</authorization_code>
      <cc_secure_pay_id>cc_secure_pay_id</cc_secure_pay_id>
      <cc_secure_transaction_id>cc_secure_transaction_id</cc_secure_transaction_id>
      <cc_secure_reference_number>cc_secure_reference_number</cc_secure_reference_number>
      <lineitem>
        <amount>amount</amount>
        <tax_per_cent_1>tax_per_cent_1</tax_per_cent_1>
        <tax_amount_1>tax_amount_1</tax_amount_1>
        <tax_per_cent_2>tax_per_cent_2</tax_per_cent_2>
        <tax_amount_2>tax_amount_2</tax_amount_2>
        <tax_per_cent_3>tax_per_cent_3</tax_per_cent_3>
        <tax_amount_3>tax_amount_3</tax_amount_3>
        <product_group>product_group</product_group>
        <service_type>service_type</service_type>
        <distribution_channel>distribution_channel</distribution_channel>
        <product_id>product_id</product_id>
        <unit_number>unit_number</unit_number>
        <text_line>text_line</text_line>
        <generic_field_1>generic_field_1</generic_field_1>
        <generic_field_2>generic_field_2</generic_field_2>
        <generic_field_3>generic_field_3</generic_field_3>
      </lineitem>
      <lineitem>
        <amount>amount</amount>
        <tax_per_cent_1>tax_per_cent_1</tax_per_cent_1>
        <tax_amount_1>tax_amount_1</tax_amount_1>
        <tax_per_cent_2>tax_per_cent_2</tax_per_cent_2>
        <tax_amount_2>tax_amount_2</tax_amount_2>
        <tax_per_cent_3>tax_per_cent_3</tax_per_cent_3>
        <tax_amount_3>tax_amount_3</tax_amount_3>
        <product_group>product_group</product_group>
        <service_type>service_type</service_type>
        <distribution_channel>distribution_channel</distribution_channel>
        <product_id>product_id</product_id>
        <unit_number>unit_number</unit_number>
        <text_line>text_line</text_line>
        <generic_field_1>generic_field_1</generic_field_1>
        <generic_field_2>generic_field_2</generic_field_2>
        <generic_field_3>generic_field_3</generic_field_3>
      </lineitem>
      <lineitem>
        <amount>amount</amount>
        <tax_per_cent_1>tax_per_cent_1</tax_per_cent_1>
        <tax_amount_1>tax_amount_1</tax_amount_1>
        <tax_per_cent_2>tax_per_cent_2</tax_per_cent_2>
        <tax_amount_2>tax_amount_2</tax_amount_2>
        <tax_per_cent_3>tax_per_cent_3</tax_per_cent_3>
        <tax_amount_3>tax_amount_3</tax_amount_3>
        <product_group>product_group</product_group>
        <service_type>service_type</service_type>
        <distribution_channel>distribution_channel</distribution_channel>
        <product_id>product_id</product_id>
        <unit_number>unit_number</unit_number>
        <text_line>text_line</text_line>
        <generic_field_1>generic_field_1</generic_field_1>
        <generic_field_2>generic_field_2</generic_field_2>
        <generic_field_3>generic_field_3</generic_field_3>
      </lineitem>
    </booking>
  </record>
  <record>
    <client_id>client_id</client_id>
    <customer_id>customer_id</customer_id>
    <address>
      <address_number>address_number</address_number>
      <title>title</title>
      <name>name</name>
      <name_2>name_2</name_2>
      <street>street</street>
      <street_2>street_2</street_2>
      <zip_code>zip_code</zip_code>
      <city>city</city>
      <country_code>country_code</country_code>
      <zip_po_box>zip_po_box</zip_po_box>
      <po_box>po_box</po_box>
      <phone_number>phone_number</phone_number>
      <fax_number>fax_number</fax_number>
      <email_address>email_address</email_address>
      <address_line_1>address_line_1</address_line_1>
      <address_line_2>address_line_2</address_line_2>
      <address_line_3>address_line_3</address_line_3>
      <address_line_4>address_line_4</address_line_4>
      <address_line_5>address_line_5</address_line_5>
      <address_line_6>address_line_6</address_line_6>
      <address_line_7>address_line_7</address_line_7>
    </address>
    <account>
      <external_customer_id>external_customer_id</external_customer_id>
      <vat_id>vat_id</vat_id>
      <language_debtor>language_debtor</language_debtor>
      <account_group>account_group</account_group>
      <reminder_block>reminder_block</reminder_block>
      <affiliates_percent_rate>affiliates_percent_rate</affiliates_percent_rate>
      <credit_card>credit_card</credit_card>
      <cc_expiry_date>cc_expiry_date</cc_expiry_date>
      <issue_date>issue_date</issue_date>
      <issue_number>issue_number</issue_number>
      <bank_id>bank_id</bank_id>
      <bank_account>bank_account</bank_account>
      <account_owner>account_owner</account_owner>
      <rib_code>rib_code</rib_code>
    </account>
    <booking>
      <transaction_id>transaction_id</transaction_id>
      <address_number>address_number</address_number>
      <transaction_code>transaction_code</transaction_code>
      <transaction_subcode>transaction_subcode</transaction_subcode>
      <transaction_date>transaction_date</transaction_date>
      <due_date>due_date</due_date>
      <amount>amount</amount>
      <invoice_ext>invoice_ext</invoice_ext>
      <order_number>order_number</order_number>
      <distribution_channel>distribution_channel</distribution_channel>
      <sale_point>sale_point</sale_point>
      <generic_field_1>generic_field_1</generic_field_1>
      <generic_field_2>generic_field_2</generic_field_2>
      <generic_field_3>generic_field_3</generic_field_3>
      <position_number>position_number</position_number>
      <payment_type>payment_type</payment_type>
      <text_line>text_line</text_line>
      <bank_id>bank_id</bank_id>
      <bank_account>bank_account</bank_account>
      <reminder_level>reminder_level</reminder_level>
      <account_owner>account_owner</account_owner>
      <reminder_block>reminder_block</reminder_block>
      <rib_code>rib_code</rib_code>
      <credit_card>credit_card</credit_card>
      <cc_expiry_date>cc_expiry_date</cc_expiry_date>
      <issue_date>issue_date</issue_date>
      <issue_number>issue_number</issue_number>
      <authorization_code>authorization_code</authorization_code>
      <cc_secure_pay_id>cc_secure_pay_id</cc_secure_pay_id>
      <cc_secure_transaction_id>cc_secure_transaction_id</cc_secure_transaction_id>
      <cc_secure_reference_number>cc_secure_reference_number</cc_secure_reference_number>
      <lineitem>
        <amount>amount</amount>
        <tax_per_cent_1>tax_per_cent_1</tax_per_cent_1>
        <tax_amount_1>tax_amount_1</tax_amount_1>
        <tax_per_cent_2>tax_per_cent_2</tax_per_cent_2>